{
  "instances": [],
  "viewPath": "",
  "viewParams": {},
  "settings": {
    "direction": "vertical",
    "slidesPerView": "auto",
    "spaceBetween": "15px",
    "enabled": true,
    "pagination": {
      "enabled": true,
      "clickable": true
    },
    "mousewheel": true,
    "navigation": true,
    "scrollbar": true
  },
  "viewStyle": {
    "classes": ""
  },
  "slideStyle": {
    "classes": "",
    "width": "100%",
    "height": "fit-content"
  },
  "style": {
    "classes": ""
  }
}